[
  {
    "case_id": "TEST_BENIGN_HV_EQUIP_01",
    "dataset": "amlsim_held_out_test_v1",
    "scenario_id": "scenario_equipment_wire",
    "cluster_id": "cluster_equipment_mfg",
    "category": "benign_control",
    "typology": null,
    "target_transaction_id": "TXN_TEST_HV_01",
    "related_transaction_ids": [],
    "related_account_ids": ["ACC_MFG_CORP_01", "ACC_HEAVY_MACHINERY_01"],
    "ground_truth_label": "BENIGN",
    "ground_truth_edges": [
      {
        "source": "ACC_MFG_CORP_01",
        "dest": "ACC_HEAVY_MACHINERY_01",
        "amount": 54000.0,
        "step": 1,
        "is_sar": false
      }
    ],
    "expected_evidence_ids": ["txn_TXN_TEST_HV_01", "account_ACC_MFG_CORP_01"],
    "expected_abstention": false,
    "user_query": "Investigate capital equipment purchase wire of $54,000.00 from ACC_MFG_CORP_01.",
    "reference_answer": "Legitimate commercial capital equipment purchase wire with verified supplier; benign.",
    "metadata": {
      "amount": 54000.0,
      "test_category": "benign_high_value",
      "account_type": "COMMERCIAL_OPERATING"
    }
  },
  {
    "case_id": "TEST_BENIGN_HV_TREASURY_02",
    "dataset": "amlsim_held_out_test_v1",
    "scenario_id": "scenario_treasury_sweep",
    "cluster_id": "cluster_treasury_global",
    "category": "benign_control",
    "typology": null,
    "target_transaction_id": "TXN_TEST_HV_02",
    "related_transaction_ids": [],
    "related_account_ids": ["ACC_GLOBAL_HOLDING_02", "ACC_TREASURY_SWEEP_02"],
    "ground_truth_label": "BENIGN",
    "ground_truth_edges": [
      {
        "source": "ACC_GLOBAL_HOLDING_02",
        "dest": "ACC_TREASURY_SWEEP_02",
        "amount": 115000.0,
        "step": 2,
        "is_sar": false
      }
    ],
    "expected_evidence_ids": ["txn_TXN_TEST_HV_02", "account_ACC_GLOBAL_HOLDING_02"],
    "expected_abstention": false,
    "user_query": "Investigate treasury rebalancing wire of $115,000.00 from ACC_GLOBAL_HOLDING_02.",
    "reference_answer": "Internal corporate treasury sweep between verified company accounts; benign.",
    "metadata": {
      "amount": 115000.0,
      "test_category": "benign_high_value",
      "account_type": "CORPORATE_TREASURY"
    }
  },
  {
    "case_id": "TEST_BENIGN_HV_SUPPLIER_03",
    "dataset": "amlsim_held_out_test_v1",
    "scenario_id": "scenario_supplier_invoice",
    "cluster_id": "cluster_supply_retail",
    "category": "benign_control",
    "typology": null,
    "target_transaction_id": "TXN_TEST_HV_03",
    "related_transaction_ids": [],
    "related_account_ids": ["ACC_RETAIL_CHAIN_03", "ACC_AGRI_COOP_SUPPLY_03"],
    "ground_truth_label": "BENIGN",
    "ground_truth_edges": [
      {
        "source": "ACC_RETAIL_CHAIN_03",
        "dest": "ACC_AGRI_COOP_SUPPLY_03",
        "amount": 42800.0,
        "step": 3,
        "is_sar": false
      }
    ],
    "expected_evidence_ids": ["txn_TXN_TEST_HV_03", "account_ACC_RETAIL_CHAIN_03"],
    "expected_abstention": false,
    "user_query": "Investigate supplier invoice settlement wire of $42,800.00 from ACC_RETAIL_CHAIN_03.",
    "reference_answer": "Wholesale food distributor supplier invoice payment; benign commercial trade.",
    "metadata": {
      "amount": 42800.0,
      "test_category": "benign_high_value",
      "account_type": "COMMERCIAL_OPERATING"
    }
  },
  {
    "case_id": "TEST_BENIGN_HV_BONUS_04",
    "dataset": "amlsim_held_out_test_v1",
    "scenario_id": "scenario_exec_payroll",
    "cluster_id": "cluster_payroll_tech",
    "category": "benign_control",
    "typology": null,
    "target_transaction_id": "TXN_TEST_HV_04",
    "related_transaction_ids": [],
    "related_account_ids": ["ACC_TECH_CORP_PAYROLL_04", "ACC_EXEC_VP_CHECKING_04"],
    "ground_truth_label": "BENIGN",
    "ground_truth_edges": [
      {
        "source": "ACC_TECH_CORP_PAYROLL_04",
        "dest": "ACC_EXEC_VP_CHECKING_04",
        "amount": 68500.0,
        "step": 4,
        "is_sar": false
      }
    ],
    "expected_evidence_ids": ["txn_TXN_TEST_HV_04", "account_ACC_TECH_CORP_PAYROLL_04"],
    "expected_abstention": false,
    "user_query": "Investigate executive bonus payroll wire of $68,500.00 from ACC_TECH_CORP_PAYROLL_04.",
    "reference_answer": "Verified annual executive bonus payroll disbursement; benign.",
    "metadata": {
      "amount": 68500.0,
      "test_category": "benign_high_value",
      "account_type": "BUSINESS_PAYROLL"
    }
  },
  {
    "case_id": "TEST_BENIGN_HV_LEASE_05",
    "dataset": "amlsim_held_out_test_v1",
    "scenario_id": "scenario_commercial_lease",
    "cluster_id": "cluster_lease_law",
    "category": "benign_control",
    "typology": null,
    "target_transaction_id": "TXN_TEST_HV_05",
    "related_transaction_ids": [],
    "related_account_ids": ["ACC_LAW_PARTNERSHIP_05", "ACC_COMMERCIAL_ESCROW_05"],
    "ground_truth_label": "BENIGN",
    "ground_truth_edges": [
      {
        "source": "ACC_LAW_PARTNERSHIP_05",
        "dest": "ACC_COMMERCIAL_ESCROW_05",
        "amount": 76000.0,
        "step": 5,
        "is_sar": false
      }
    ],
    "expected_evidence_ids": ["txn_TXN_TEST_HV_05", "account_ACC_LAW_PARTNERSHIP_05"],
    "expected_abstention": false,
    "user_query": "Investigate commercial lease escrow transfer of $76,000.00 from ACC_LAW_PARTNERSHIP_05.",
    "reference_answer": "Annual office space commercial lease wire to verified escrow trustee; benign.",
    "metadata": {
      "amount": 76000.0,
      "test_category": "benign_high_value",
      "account_type": "COMMERCIAL_ESCROW"
    }
  },
  {
    "case_id": "TEST_BENIGN_HV_DIVIDEND_06",
    "dataset": "amlsim_held_out_test_v1",
    "scenario_id": "scenario_subsidiary_dividend",
    "cluster_id": "cluster_dividend_opco",
    "category": "benign_control",
    "typology": null,
    "target_transaction_id": "TXN_TEST_HV_06",
    "related_transaction_ids": [],
    "related_account_ids": ["ACC_OPCO_SUBSIDIARY_06", "ACC_PARENT_HOLDCO_06"],
    "ground_truth_label": "BENIGN",
    "ground_truth_edges": [
      {
        "source": "ACC_OPCO_SUBSIDIARY_06",
        "dest": "ACC_PARENT_HOLDCO_06",
        "amount": 89000.0,
        "step": 6,
        "is_sar": false
      }
    ],
    "expected_evidence_ids": ["txn_TXN_TEST_HV_06", "account_ACC_OPCO_SUBSIDIARY_06"],
    "expected_abstention": false,
    "user_query": "Investigate intercompany dividend distribution of $89,000.00 from ACC_OPCO_SUBSIDIARY_06.",
    "reference_answer": "Quarterly intercompany dividend transfer between verified consolidated corporate entities; benign.",
    "metadata": {
      "amount": 89000.0,
      "test_category": "benign_high_value",
      "account_type": "COMMERCIAL_OPERATING"
    }
  },
  {
    "case_id": "TEST_SUSP_LV_STRUCT_07",
    "dataset": "amlsim_held_out_test_v1",
    "scenario_id": "scenario_micro_structuring",
    "cluster_id": "cluster_struct_smurf",
    "category": "structuring",
    "typology": "structuring_avoidance",
    "target_transaction_id": "TXN_TEST_LV_07",
    "related_transaction_ids": [],
    "related_account_ids": ["ACC_SMURF_INDIVIDUAL_07", "ACC_MULE_DROP_07"],
    "ground_truth_label": "SUSPICIOUS",
    "ground_truth_edges": [
      {
        "source": "ACC_SMURF_INDIVIDUAL_07",
        "dest": "ACC_MULE_DROP_07",
        "amount": 9450.0,
        "step": 7,
        "is_sar": true
      }
    ],
    "expected_evidence_ids": ["txn_TXN_TEST_LV_07", "account_ACC_SMURF_INDIVIDUAL_07"],
    "expected_abstention": false,
    "user_query": "Investigate deposit of $9,450.00 from ACC_SMURF_INDIVIDUAL_07.",
    "reference_answer": "Intentional structuring deposit just below statutory $10,000 CTR reporting threshold; suspicious.",
    "metadata": {
      "amount": 9450.0,
      "test_category": "suspicious_low_value",
      "account_type": "INDIVIDUAL_CHECKING"
    }
  },
  {
    "case_id": "TEST_SUSP_LV_RELAY_08",
    "dataset": "amlsim_held_out_test_v1",
    "scenario_id": "scenario_relay_mule",
    "cluster_id": "cluster_relay_hop",
    "category": "layering",
    "typology": "scatter_gather_passthrough",
    "target_transaction_id": "TXN_TEST_LV_08",
    "related_transaction_ids": ["TXN_TEST_LV_08_IN"],
    "related_account_ids": ["ACC_ANON_ORIG_08", "ACC_RELAY_MULE_08", "ACC_OFFSHORE_SINK_08"],
    "ground_truth_label": "SUSPICIOUS",
    "ground_truth_edges": [
      {
        "source": "ACC_ANON_ORIG_08",
        "dest": "ACC_RELAY_MULE_08",
        "amount": 1480.0,
        "step": 8,
        "is_sar": true
      },
      {
        "source": "ACC_RELAY_MULE_08",
        "dest": "ACC_OFFSHORE_SINK_08",
        "amount": 1450.0,
        "step": 8,
        "is_sar": true
      }
    ],
    "expected_evidence_ids": ["txn_TXN_TEST_LV_08", "account_ACC_RELAY_MULE_08"],
    "expected_abstention": false,
    "user_query": "Investigate rapid pass-through wire of $1,450.00 from ACC_RELAY_MULE_08.",
    "reference_answer": "Rapid transit layering hop through zero-balance pass-through intermediary mule; suspicious.",
    "metadata": {
      "amount": 1450.0,
      "test_category": "suspicious_low_value",
      "account_type": "INDIVIDUAL_CHECKING"
    }
  },
  {
    "case_id": "TEST_SUSP_LV_BRANCH_SMURF_09",
    "dataset": "amlsim_held_out_test_v1",
    "scenario_id": "scenario_branch_smurfing",
    "cluster_id": "cluster_smurf_branch",
    "category": "structuring",
    "typology": "velocity_burst",
    "target_transaction_id": "TXN_TEST_LV_09",
    "related_transaction_ids": [],
    "related_account_ids": ["ACC_BRANCH_SMURF_09", "ACC_COLLECTOR_09"],
    "ground_truth_label": "SUSPICIOUS",
    "ground_truth_edges": [
      {
        "source": "ACC_BRANCH_SMURF_09",
        "dest": "ACC_COLLECTOR_09",
        "amount": 2900.0,
        "step": 9,
        "is_sar": true
      }
    ],
    "expected_evidence_ids": ["txn_TXN_TEST_LV_09", "account_ACC_BRANCH_SMURF_09"],
    "expected_abstention": false,
    "user_query": "Investigate velocity burst transfer of $2,900.00 from ACC_BRANCH_SMURF_09.",